text,cue_pos,experiencer_pos
"Workplace Overdoses on the Rise, New Study Says",Overdoses on the Rise,
"UN says thousands flee Congo violence, seek asylum in Uganda",violence,UN
"Fox’s Jesse Watters Says He’s ‘Tired and Bored’ of AOC, Proceeds to Talk at Length About Her",Tired and Bored,Fox’s Jesse Watters
Rashida Tlaib Spouts Politically Correct Anti-Semitism for the 21st Century,Anti-Semitism,Rashida Tlaib
I'm a freelance writer with student loans who's kept excellent credit as I move all over the US. Here's exactly how I do it.,excellent credit,freelance
"Pelosi hits back at Trump's attacks on Cummings, calls Kushner a 'slumlord'",hits back,Pelosi
Nancy Pelosi’s ‘Equality Act’ Would Be Disastrous. Here Are 5 Likely Victim Groups.,Disastrous,Nancy Pelosi’s
"Leon Redbone, a mysterious musician who evoked a bygone era, has died",has died,Leon Redbone
Peruvian President Vizcarra proposes early legislative elections,proposes,Peruvian President Vizcarra
Letters: Maybe Dan Fagan should read Hemingway and Thoreau,should read,Dan Fagan
This tea party charity sends care packages to troops. California says it misspent funds,misspent,
Revisiting Quentin Tarantino’s ‘Inglourious Basterds’ in the Trump era,‘Inglourious Basterds’,
Texas law firm reveals it is working with Russia’s ally in the Balkans,,
Trump Calls Squad ‘Nightmare for America’,Nightmare,Trump
The Senate just extended the September 11th Victim Compensation Fund through 2090,extended,
"Trump, Brazil’s Bolsonaro flaunt nationalist bromance",flaunt,Trump
Media Slime Novelist Nicholas Sparks As Racist Homophobe, Racist Homophobe,
"We Need a New Patriotism, One That Embraces Dissent",New Patriotism,
"Hey Donald Trump, the eyes of history are watching",watching,Donald Trump
Dem rep’s House speech: I’m tired of hearing about abortion from “sex-starved males on this floor”,tired,
Google Suspends Partial Business with China’s Huawei after Trump Blacklist,Suspends,Google
Starbucks Promised a Recyclable Drink Lid. Don’t Believe the Hype.,Don’t Believe,
Florida Man Killed by World’s Most Dangerous Bird,Killed,Florida Man
Space telescope snaps a celestial family,snaps,Space telescope
"One Small Step for a President, One Giant Leap for Pyongyang",Giant Leap,
Deputies raid rapper YG's Hollywood home in connection with fatal shootout,raid,YG's
Trump Pushes Another Bailout for ‘Patriot Farmers’ Hurt by His Trade War,Pushes,Trump
Former Chinese Interpol chief 'admits his crimes' of accepting $2m bribes,crimes,Interpol
"Feds Charge Greg Craig, Former Obama Lawyer Tied to Manafort Ukraine Report",Tied,Greg Craig
It’s Impossible Not to Smile at Deepika Padukone’s Voluminous Pink 2019 Met Gala Gown. Here’s the Story Behind It.,Smile,Deepika Padukone’s
"Parents of 16-year-old who was fatally shot by L.A. police reach $200,000 settlement",Parents,
Germany Has a Neo-Nazi Terrorism Epidemic,Terrorism,Germany
Sandra Guzman: Women in Puerto Rico know all too well why Rossello must resign,resign,Sandra Guzman
Golf: Bethpage Black turns into beast in windy final round at PGA,turns into beast,
Peaceful Conservative Attacked By Leftist Liberal For Asking A Question,Attacked,Peaceful Conservative
Michael Moore Rips Democrats for Putting Faith in 'Frail Old Man' Robert Mueller,Rips,Michael Moore
"Four dead in Venezuela clashes after opposition uprising, rights group says",dead,
"Yes, Trump Obstructed Justice. And William Barr Is Helping Him Cover It Up.",Obstructed,Trump
Alabama Police Ruined a Couple’s Lives Over $50 of Weed. Now the Charges Against Them Have Been Dropped,Ruined,Couple’s
Kamala Harris and Donald Trump Unite to Defend the Imperial Presidency,Unite,Kamala Harris and Donald Trump
"Baltimore Residents: Trump's Attacks on the City Are Rooted in ""Racism and White Supremacy""",Attacks,Baltimore Residents
Carrie Underwood immortalized in cheese sculpture at Milwaukee stop of Cry Pretty tour,immortalized,Carrie Underwood
F1: Lewis Hamilton wins Canadian GP after penalty denies Vettel – live!,wins,Lewis Hamilton
"Seven motorcyclists killed, 3 injured in crash with pickup truck",killed,
RAAF pilots are taught to think of women during bombing operations,taught,RAAF pilots
Bill Maher and filmmaker John Waters brutally troll Trump with epic smack-down on HBO’s ‘Real Time’,brutally,Bill Maher
Disturbing report reveals Trump is allowing U.S. bomb parts to be built in Saudi Arabia — despite objections from Congress,Disturbing,Trump
"For the week, Dow loses 0.6%, while S&P and Nasdaq both down 1.2%,",loses,Dow
National Popular Vote Movement Tries to Win Over Skeptical Conservatives,Tries,National Popular Vote Movement
"After Attacks On Assyrians, Northern Iraq’s Christian Minority Recommits To A Homeland",Attacks,
Veterans Affairs site suicides prompt new concern,suicides,
Saudi business feels ‘pain’ of crown prince’s reforms,‘pain’,Saudi business
What Happens When Your Girlfriend Finds Out You're into Trans Women,Finds,Girlfriend
The Trump Administration Just Rolled Back Obama's Historic Climate Change Plan,Rolled,
Obama honors 'American statesman' Richard Lugar,honors,Obama
Donald Trump’s Unprecedented Assault on the Power of Congress,Assault,Donald Trump’s
Terrified city workers in Virginia Beach shooting: All you could hear was gunshots,Terrified,workers
"Number of the Day: 18% of ER Visits End with Surprise Bills, Report Says",Surprise Bills,
Enbridge Is Behind This Front Group Pushing the Company’s Line 3 Oil Pipeline,Pushing,
AIPAC Targets Bernie Sanders in Facebook Ads Focused on Key Democratic Primary States,Targets,AIPAC
Feds probe MTA overtime king Thomas Caputo and other LIRR workers,probe,Feds
The Queen makes kings of Spain and Netherlands Knights of the Garter,Knights of the Garter,The Queen
What to Read If ‘Game of Thrones’ Let You Down,Down,
"Angela Davis & Barbara Ransby: We Stand with Rep. Ilhan Omar, a Courageous, Bold Black Woman",Courageous,Angela Davis & Barbara Ransby
Italy explains refusal to recognize Venezuela's Guaido,refusal,Italy
"Ari Fleischer Lied, and People Died",Died,Ari Fleischer
The boundaries between politics and stand-up comedy are crumbling,crumbling,
Sri Lanka Attacks Highlight Growing Worldwide Persecution Of Christians,Attacks,Sri Lanka
Boeing 737 Max: company unveils new safety fixes,unveils,Boeing 737 Max
POLL: Democratic Women Okay With ‘Handsy’ Joe Biden,‘Handsy’,Women
The Grotesque Horror Show of the Tory Leadership Race,Horror,
Kellyanne Conway just did it again,did it again,
Global $397.2 Bn Facade Systems (Residential and Non-residential) Market 2018-2019 & Forecasts to 2023,,
‘It Feels Like a Whole Century Was Cut Out.’ Chinese Censors Slice Six Minutes from Game of Thrones Premiere,‘It Feels,
Ida B. Wells Society and ProPublica Announce the 2019 Data Institute,Announce,
House Panel Threatening Subpoenas Over Census Question,Threatening,House Panel
These scientists tracked South Africa’s sardine run over 66 years,tracked,
‘They would get killed’: The weather forecast that saved Apollo 11,killed,
War With Iran Wouldn’t Be Like Iraq. It Would Be Worse.,War,Iran
Millennials: Stop Talking About ‘Adulting’ and Become Adults,Talking,Millennials
The Inside Story of the $6 Million ‘Devil’s Violin’ Heist,Heist,
British Members of Parliament Do All Their Sneaky Plotting on WhatsApp,Sneaky Plotting,British Members of Parliament
"WWII plane rescued from boneyard flies again, heads for D-Day ceremonies",rescued,WWII
Ethiopia Is at a ‘Very Critical Juncture’,Critical,
Chris Plante: 'CNN Is Part of the Democratic Party's Apparatus',,Chris Plante
Justin Amash's Principled Stand Against Trump Will Not Make Him Popular in the GOP,Against,Justin Amash
This Belgian Nurse Watched Euthanasia Turn Pain Management Into A Death Prescription,Watched,Belgian
Mexican Cartels Fight for Control of Border State Prison,Fight,
House Dems Get Dark Money Group After Introducing Bill Against Dark Money,Get Dark Money,Dems
"F1: ‘Sebastian Vettel only needs one good race - it’s just a phase’, says Nico Rosberg",good,Sebastian Vettel
Sotheby’s snapped up by French tycoon Drahi for $3.7 billion,snapped,Sotheby’s
Will Hurd says he’s leaving Congress to help GOP become more diverse,leaving,Will Hurd
Pharmacy Middlemen Will Take Their Turn in the Congressional Hot Seat,Take,Pharmacy Middlemen
Senate Democrats Show What Real Confirmation Obstruction Looks Like,Obstruction,Senate Democrats
Quarter of Brits lose sleep over debt,lose sleep,
Dear Wives: Publicly Criticizing Your Husband Makes You Look Horrible,Horrible,
CNN Hits Harris for Repeatedly Dodging Questions: ‘Could Be a Big Problem for Her’,Hits,CNN
Devin Nunes’ 2020 Reelection Bid May Have Just Gotten a Lot Easier,,Devin Nunes
The Rape Culture That Fueled Steubenville Still Thrives Online. Here’s Why That Matters.,Rape Culture,Steubenville
Plunging response rates to household surveys worry policymakers,worry,policymakers
Saudi Arabia Plans To Let Women Leave The Country Without The Permission Of A Man,Plans,Saudi Arabia
Divers Set World Record For Cleaning Trash From Ocean Floor,Record,Divers
"Russian Police Arrest More Than 1,000 Protesters In Moscow",Arrest,Russian Police
Iran Stepping Back After Preparing To Attack US Forces,Attack,Iran
"After years of decrying McCarthyism, Lindsey Graham accuses members of Congress of being Communists",accuses,members of Congress of being Communists
Russia Agrees To Free Nearly 100 Captive Whales,Agrees,Russia
"Woman Who Was Allegedly Beaten At Dominican Resort Demanded $2.2M Before Going Public, The Resort Said",Demanded,Woman
‘Anti-semitic rhetoric’ at Duke-UNC event prompts Rep. Holding to ask for federal probe,prompts,Duke-UNC event
They wanted a son so much they made their daughter live as a boy,wanted,
Jason Sudeikis Returns to 'SNL' to Portray Joe Biden in Sensitivity Training Sketch,Returns,Jason Sudeikis
Amanda Knox Returns To Italy For First Time Since Being Freed From Prison In 2011,Returns,Amanda Knox
"North Korea Tests A ‘New-Type Tactical Guided Weapon,’ State-Run Media Claims",Weapon,North Korea
Iowa High School Gives Students PE Credits For Helping The Elderly With Yard Work,,
The 'Wild West' of Weed Is Dying Out. Here's What's Replacing It,Dying Out,'Wild West' of Weed
"Homelessness among Michigan’s children: The problem is far larger, and more diverse, than you think",problem,
A U.S. Marine Looks Back at Fallujah,Back,
TV Actress Pleads Guilty In Bizarre Case Of Secretive Sex Cult,Guilty,TV Actress
"Money launderer, 67, convicted of £10million Jewish charities scam after going on the run",convicted,Money launderer
Baseball is the only sport that justifies optimism on Opening Day,optimism,Baseball
"Notre Dame Fire Could've Been Caused By A Cigarette, Prosecutors Say",Caused,Notre Dame
Study: Peppermint Helps the Meal Go Down,Helps,
GLAAD Poll: Young Americans Are Increasingly Uncomfortable With LGBTQ Culture,Uncomfortable,Young Americans
"Julian Castro spotlights housing, homelessness at labor forum for 2020 candidates",spotlights,Julian Castro
Funny Shots from the Archives of Iconic Photographer Martin Parr,Shots,
Insane video shows Viking Sky cruise ship thrown into chaos at sea,thrown into chaos at sea,Viking Sky
Lawmakers Introduce a Bipartisan Bill to Fix the IRS,Bill to Fix,Lawmakers
"Carpe Donktum says HuffPost is coming for him now, but he’s got a message for them",coming,Carpe Donktum
"Baton Rouge man arrested in child pornography probe; 100-plus images found, officials say",arrested,Baton Rouge
Getting Nostalgic About Segregationist Senators Isn’t “Moderate”,Nostalgic,
Arms Dealers and Lobbyists Get Rich as Yemen Burns,Arms,Dealers
"Antisemitic Incidents Surge in Berlin with over 1,000 Cases in 2018",Incidents,
Much of Notre Dame Cathedral's structure and artifacts miraculously survive the destructive fire,survive,
"To Remain Free, We Need To Deepen Our Understanding Of The Declaration",Remain Free,
"Sri Lankan Gov't Responds to Unprecedented Attacks with Surveillance, Social Media Blackout, Curfew",Attacks,Sri Lankan Gov't
Managers of Grade II-Listed Georgian mansion left their herd of fallow deer to starve to death,to starve to death,
Fear of immigration raids looms as plans for ICE ‘family operation’ move forward,Fear,
"Red States Could Lose Big Because of the Census, Rep. Mo Brooks Explains",Lose,Red States
Cricket World Cup: reserve day row after yet another washout,yet another washout,
Heavy rains in Japan cause deadly landslides and floods,deadly,Japan
Food stolen from thousands of hungry people,stolen,
"After letter from former undocumented employees, Trump feigns ignorance",ignorance,Trump
Fired Harvard Dean Ronald Sullivan: 'Unchecked Emotion Has Replaced Thoughtful Reasoning on Campus',Fired,Ronald Sullivan
Hundreds evacuated after WWII-era bomb found in Germany,evacuated,Hundreds
"July WTI oil gains 72 cents, or 1.2%, to settle at $58.63/bbl",gains,WTI oil
Trump order to make medical service costs more transparent,transparent,Trump
Street Clashes Erupt As Venezuela's Guaido Urges Uprising,Erupt,
Newsletter: Essential California Week in Review: A tragedy in Gilroy,tragedy,Newsletter
Beto O'Rourke busted by angry voter for accepting lobbyist money while claiming not to accept it,angry,Beto O'Rourke
Warren Rolls Out $7 Billion Plan to Boost Minority Entrepreneurs,Boost,Warren Rolls
An epidemic of body shaming is taking its toll on men’s mental health,shaming,
"Authentic Brands in talks with Meredith to buy Sports Illustrated, in deal valuing SI at about $110 mln--WSJ",,
Leon Panetta: Trump’s Foreign 'Dirt' Comments Are a ‘Violation of the Oath of Office’,Violation,Leon Panetta
"Washington Post Editorial Board Slams Sanders, Teachers Unions for Charter School Opposition",Slams,Washington Post Editorial Board
These are the 5 TV shows that both liberals and conservatives love,love,liberals
Horror as climber in his 50s plunges to his death while scaling the highest mountain in Ireland,Horror,
Beto 2.0: Campaign hires Obama MVP for delegate hunt,hires,Beto 2.0
Alexandria Ocasio-Cortez rips Steve King: ‘You were too racist even for’ Republicans,racist,Alexandria Ocasio-Cortez
Officials Say Gang Violence Suspected In Mass Shooting Outside Pa. Nightclub, Gang Violence,Officials
People Are So Floored By Blue Ivy’s Singing on Beyonce’s Surprise Album Homecoming They’re Joining the Ivy League,Floored,
‘It snuck up on us’: Scientists stunned by ‘city-killer’ asteroid that just missed Earth,stunned,Scientists
"Big news: AOC’s chief of staff, comms director to leave her office",leave,AOC’s chief of staff
"Deutsche Bank axe hovers over 1,000 clients",axe hovers,Deutsche Bank
16-Year-Old Girl Faces Child-Porn Charges for Making Video of Herself,Child-Porn,16-Year-Old Girl
Police find body in search for missing zoology graduate Rosie Johnson six days after disappearance,body,Police
The Release of Ivan Golunov and the Power of Collective Action in Russia,Release,Ivan Golunov
Ben Has Somehow Never Seen an Episode of Game of Thrones. Amanda Exposes His Hilarious Stupidity.,Game of Thrones,
Sisi says Egypt won’t accept anything against Palestinian wishes,won’t accept,Sisi
"'Holocaust' trends on Twitter after Ocasio-Cortez, Liz Cheney remarks on concentration camps",trends,Ocasio-Cortez
Poll: Democrats Increasingly Think DOJ Meddled in Mueller Probe,Increasingly,Democrats
"As Countries Seek Trade With China, Imprisoned Uyghur Muslim Community Has Become ""Collateral Damage""",Collateral Damage,China
"North Korea won’t give up all its nuclear weapons, former Defense Secretary Gates says",weapons,
These Horrifying Family Separation Cases Have All Happened Since Trump “Ended” the Policy,Horrifying Family Separation,Family
Maternal Obesity Linked to Childhood Cancer,Cancer,
"In Canada, insulin is a tenth of the price it is here—because our healthcare system is still broken.",still broken,
"British man, 37, arrested by Spanish police over a carjacking",arrested,British man
Srećko Horvat: ‘The current system is more violent than any revolution’,violent,
Jake Tapper laughs in Pence’s face: ‘We don’t have the cleanest air and water in the world’,laughs,Jake Tapper
Trump Administration Losing 94 Percent of Lawsuits Over Illegal Policy Changes,Losing,Trump Administration
Russian ship nearly collides with U.S. warship in Philippine Sea,collides,Russian ship
"Coalition Airstrikes in Raqqa Killed at Least 1,600 Civilians, More Than 10 Times U.S. Tally, Report Finds",Killed,
Atheist group complains 'God bless America' is said at elementary school after daily pledge. District quickly falls in line.,complains,Atheist group
Study: Smoking During Pregnancy Increases Obesity Risk of Baby,,Baby
The Loudest Voice Stars A Very Simple Monster,Stars,
Appeals court grants Trump administration win to snub ‘sanctuary cities’,grants,Trump administration
IMF gives Mozambique $118 million for Cyclone Idai rebuilding,gives,IMF
The House Just Voted to Raise the Minimum Wage to $15,Raise,House
Black Hole Given the Hawaiian Name ‘Powehi.’ Here’s What That Means,Given,Black Hole
California becomes the first state to make hair discrimination illegal,illegal,California
Ocasio-Cortez says some communities in the US have 'no choice' but to riot,riot,Ocasio-Cortez
Iran crisis: A tale of two tankers,crisis,Iran
"World War One fanatic's collection of bombs and shells is set to fetch £5,000 at auction",fanatic's collection of bombs and shells,
Angiogenesis Foundation President And CEO Dr. William Li's EAT TO BEAT DISEASE Achieves New York Times Bestseller Status,Achieves,Dr. William
Brooks: 'A Lot of People Got Out Ahead of the Evidence' on Collusion - Trump Isn't Exonerated,Exonerated,Brooks
Daughter of Army vet who died at Dominican resort: Funeral home 'pressured' me to make a decision about my father's remains,'pressured',Daughter of Army
USA Today Sports Attacks on 'Raging' Trump Appear To Be Coordinated Media Campaign,Attacks,
"Nasdaq on track for best monthly gain, up 5.4%, since January",gain,Nasdaq
Toddler Diagnosed With Rare Ovarian Cancer Is Now Cancer-Free,Diagnosed,
STUNNING: Boeing’s 737 Max Software Outsourced to $9-an-Hour Engineers from Indian Software Developer,STUNNING,
"Judiciary Committee votes to hold Barr in contempt, Nadler declares “constitutional crisis”",contempt,Judiciary Committee
"White House expects retaliation from China, stresses ongoing talks",expects retaliation,White House
Bernie Sanders Fox News town hall draws more than 2.55 million,draws,Bernie Sanders
Justice Thomas Issues Fiery Condemnation of Eugenic Abortion,Condemnation,Justice Thomas
Democrats Ponder How to Avoid a Climate Debate,Ponder,Democrats
Today’s back pages: Oh Nou! United blown away by a Barcelona and Messi masterclass,blown,United
A ‘fantasy’: Medieval scholars educate white nationalists on their ‘pure white Europe’ claims,educate white nationalists,Medieval scholars
Private Group Pledges Nearly $10 Million to Gun Research,Pledges,Private Group
‘Try again’: NowThis’ attempted gotcha on Alabama anti-abortion law ‘might be the dumbest comparison I have ever seen’,dumbest,
"Jordan Klepper, Wyatt Cenac, and the Citizen Journalism of Class Clowns Made Good",Good,
Woman Pays Dinner Bill For Group Of Teens On Prom Night,Pays,Woman
Zero Elephants Killed By Poachers In Over A Year At One Of Africaand#039;s Largest Wildlife Preserves,Zero Elephants Killed,
Facebook Emails Reveal That Mark Zuckerberg Doesn’t Care About Your Privacy,Care,Mark Zuckerberg
Julián Castro calls Trump Jr a ‘coward’ over racist attack on Kamala Harris,coward,Julián Castro
College Costs Are Out of Control. Here’s What Can Be Done.,Out of Control,
Two riders injured in Port Allen after horses struck by truck,injured,
The richest country in the world,richest,richest
US hiring bounces back in March but wage growth cools,cools,US
China Is Burning Away Its Ecological Future,Burning,
"Dutch police arrest Syrian suspected of war crimes, terror",arrest,Dutch police
Hospital Staff Helps Teens Go To Prom After Car Accident,Helps,Hospital Staff
A day at the beach could get a bit more expensive. L.A. County is voting on fee hikes,expensive,
Dozens of Business Leaders Advocate Abortion Access: ‘Don’t Ban Equality’,Abortion,
A second mass shooting erupts in Ohio. Shooter identified,erupts,Ohio
Mario Lopez Attacked for Saying Parents Shouldn't Let Their Children Choose Genders,Attacked,Mario Lopez
Netanyahu's future clouded by rivalry with former ally,clouded,Netanyahu's
Sanders to Ryan on Medicare for All: 'I wrote the damn bill',damn,Sanders
The benefit workers want most is less work,most,
Poll: Warren Viewed Unfavorably by 46 Percent of Massachusetts Voters,Unfavorably,Warren
"Setting Precedent, A Federal Court Rules Jail Must Give Inmate Addiction Treatment",Treatment,
"For Women of Colour, Family Shame Can Make Abortions Traumatic",Shame,Women of Colour
"Marijuana battles turn ugly in one California city: Fistfights, nasty accusations and questions",ugly,
"Wimbledon 2019: On a Day When Serena Williams Didn’t Have It, Simona Halep Had It All",All,Serena Williams
Robert Mueller Has Completed His Investigation Into Donald Trump and Russia,,
American Dark Money Is Fueling the Rise of Europe’s Far Right,Fueling,American Dark Money
Joe Biden: Build 'James Bond-Style' Guns That Don't Fire Without DNA Match,Guns,Joe Biden
Immigration Officials Use Secretive Gang Databases to Deny Migrant Asylum Claims,Deny,Immigration Officials
Rescue team search for British man who vanished after taking a jet ski out to sea in Tenerife,vanished,Rescue team
Trump’s Bank Appears Willing to Cooperate With Investigation Against Him,Investigation,Trump
"Rep. Clyburn disappointed by Kamala Harris, believed it was 'the year of the black woman'",disappointed,Rep. Clyburn
Teflon Toxin Safety Level Should Be 700 Times Lower Than Current EPA Guideline,700 Times Lower,
Congressional Leaders to Start Budget Talks with White House Next Week: Report,,Congressional Leaders
Watchdog orders energy companies to reduce their price rises,orders,Watchdog
Callidus Capital Announces Liquidity and Recapitalization Arrangements and Provides Update on Timing of Release of Financial Statements,Announces,Callidus Capital
AF Units Ordered to Take Day to Address Increased Suicides,Ordered,AF Units
Libya's Sarraj calls for elections in 2019 to end war,end war,Libya's Sarraj
Dow takes 700-point nosedive as trade war escalates,nosedive,Dow
"Candidates of a certain age, &c.",,
US resident freed by Iran to Trump: 'Get back your hostages',freed,US resident
Trump's evolving remarks on Russian election interference,Russian election interference,
Here’s how economists are blocking progress on climate change,blocking,economists
From Biggie to Kendrick Lamar: outtakes from hip-hop’s most iconic,outtakes,Biggie
Finland's new generation of climate heroes,heroes,Finland
California synagogue rabbi injured in shooting: 'Terror will not win',injured,
"Far-Right Groups Embrace ‘Straight Pride Parades’ to Win Recruits, Media Attention",Pride,Far-Right Groups
Poll: John Bel Edwards Vulnerable in Louisiana,Vulnerable,John Bel Edwards
Pat Gray: We are one step closer to '1984',closer,Pat Gray
Warren Unveils Plan For $1 Trillion In New Taxes On Big Corporations,,
You’ve heard stories of Indian Army and Air Force heroes. Now here’s an angel from the Navy,here’s an angel,Indian Army
Cape Town - tourist hotspot where eight people are murdered a day,hotspot,
Donald Trump’s downward spiral has pushed the GOP to its breaking point,breaking,Donald Trump
"Boris Johnson for Prime Minister, and Other Ways that the Brexit Mess Could Get Even Worse",Worse,Boris Johnson
Redskins pick-by-pick draft analysis: Bryce Love joins crowded backfield; Washington adds depth on offensive line,joins,Bryce Love
Bill Gates reveals the biggest mistake of his career,mistake,Bill Gates
Puerto Rico Enters Uncharted Territory as Ricardo Rosselló Prepares to Resign as Governor,Resign,Puerto Rico
The City where you can change your gender... at the click of a single button,change your gender,
The Atlantic: Sure looks like MH-370 disappearance was pilot suicide,suicide,
Here’s How Many Assault-Style Weapons Have Been Returned In New Zealand,,
What’s Fact and What’s Fiction in Fosse/Verdon Episode 3,Fiction,
Japan-South Korea feud threatening global chip supply,Japan-South Korea feud threatening global chip supply,
Stand Up to Anti-Semitism and Historical Revisionism. Because Truth Matters.,Stand Up,
"Putin, Xi, Assad, and Maduro vs. the American Hegemon",vs,"Putin, Xi, Assad, and Maduro"
Brian Williams Interrupts Barr Hearing to Call Lindsey Graham a Liar,Interrupts,Brian Williams
Don Lemon Admits AOC Faked Black Accent,Admits,Don Lemon
Target upgraded to equal weight at Morgan Stanley,,
"Trump suddenly reverses course on Iran, says there is ‘no indication’ of threats",‘no indication’ of threats,Trump
Racist Voter Suppression Made Alabama’s Abortion Ban Possible,Racist Voter Suppression,
Kindergarten Cop actor is arrested for public intoxication in Alabama,arrested,
"Jealous Massachusetts teen found guilty of killing, beheading classmate",guilty,teen
"When Nekhidia Harris was born, doctors didn't think she would live past 3 days — now she's a college grad",grad,Nekhidia Harris
Pence Dodges Questions About Poor Conditions At Child Migrant Centers,Dodges,Pence
The 30 most popular products from last year's Amazon Prime Day — including the ones that surprised us,surprised,
Hong Kong protests: Police use tear gas on protesters,protests,Hong Kong
Harris Releases ‘Medicare for All’ Plan That Allows for Limited Private Insurance,Medicare for All,
