text,cue_pos,experiencer_pos
Sweden Could Reopen Rape Investigation of Julian Assange; U.K. Urged to Prioritize Swedish Case Over Extradition to U.S.,Rape,Sweden
"Joy Behar: Republicans Aren't Patriotic; They're Disrespectful to Veterans, Lock Up Children!",Disrespectful,Joy Behar
"TIME Picks Christine Blasey Ford as 'Influential,' Kamala Harris Pens Puff Piece",Influential,Christine Blasey
‘Shell on Challenge’: The Viral Hoax Fooling Local News Into Thinking Teens Are Eating Plastic for Fun,Hoax,
"Depression is on the rise among millennials, but 20% of them don't seek treatment — and it's likely because they can't afford it",Depression,millennials
Ross Perot donated to Trump’s re-election campaign before death: report,donated,Ross Perot
Trump’s sanctions on Iran are hitting Hezbollah hard,sanctions,Trump
"Hezbollah Isn’t Just in Beirut. It’s in New York, Too.",,Hezbollah
"Polls reveal 2 ways Scotus decisions shape society, one positive, another not so much",positive,Scotus
The United States Is Notoriously Bad at Counting Civilian Casualties. Its Allies Are Even Worse.,Bad,The United States
Rep. Brindisi fires aide charged with paying 17-year-old prostitute,fires,Brindisi
Sri Lanka Arrests Father Of Suspected Easter Suicide Bombers,Arrests,Father
Hong Kong Launches Massive Resistance Against China,Massive Resistanc,
'Ma’amageddon': secret plans for Queen's nuclear address revealed,secret plans,Ma’amageddon
Trump to Congress: It’s None of Your Business if I Break the Law,Break,Trump
"Dolly Parton Donates $200,000 To Volunteer Firefighters",Donates,Dolly Parton
"NASA Is Offering $18,500 to Lie in Bed for 60 Days",Lie in Bed,NASA
"Before Trump criticized the urban poverty he uses to attack Democrats, he profited from it",criticized,Trump
"Police said he licked ice cream and put it back. Video, he claims, doesn’t show the whole story.",licked,Police
"Beer Industry Blames Tariffs for 40,000 Job Losses",Blames,Beer Industry
Short Circuit: A Roundup of Recent Federal Court Decisions,Short Circuit,
Sen. Kennedy Calls The Squad 'The Four Horsewomen Of The Apocalypse',Squad,Sen. Kennedy
"Stateless in Africa: Why 700,000 have their 'dreams ended'",'dreams ended,Stateless in Africa
McCarthy Slams Dems for Passing Minimum Wage Bill,Slams,McCarthy
Opioid Users Call Kratom a Godsend. The F.D.A. Says It’s a Menace.,Menace,Opioid Users
Fascinating NYT essay on a man’s journey on guns,Fascinating,NYT
POLITICO Playbook: How will Trump’s race drumbeat play in 2020,POLITICO,
"Boy, 14, is airlifted to hospital after a TREE falls on him while he walks into school",TREE falls on him,Boy
Move Over Coffee Cup. Fans Think Jaime Lannister Grows His Right Hand Back in This Game of Thrones,Fans,
Zion Williamson and the N.B.A. Draftees Usher in a New Era of Basketball,New Era,
"Amid Trump’s Attacks, Planned Parenthood Broadens Health Care Focus",Attacks,Trump’s
Judge Agrees To Release Coast Guard Officer Accused Of Plotting Terror Attack,Terror,Judge
White supremacy must be undone — institution by institution,undone,
Feltham YOI: 13 prison guards hospitalised after teenage inmates riot,hospitalised,prison guards
Pelosi Sounds Alarm Over Trump Impeachment; 'Villainous' Trump Throws Fuel On The Fire,Villainous,Pelosi
FNC's Wallace: Trump Is Calling People of Color 'Vermin' -- 'It Sounds Subhuman',Vermin,Trump
Inside Iran: Iranians on Trump and the nuclear deal,nuclear deal,Iranians
Dozens of rockets launched into Israel,rockets launched,Israel
Geraint Thomas taken to hospital after heavy crash at Tour de Suisse,heavy crash,Geraint Thomas
Carolyn Hax: Husband’s abusive mom isn’t the only one who owes him an apology,abusive,Carolyn Hax
Suspects in killing of off-duty LAPD officer identified,killing,
"Trump Doubles Down On ‘Go Back’ Attack: ‘If You Don’t Like It' Here, 'You Can Leave’",Attack,Trump
ProPublica Illinois and ProPublica Earn Three NABJ Salute to Excellence Awards Nominations,Salute to Excellence Awards Nominations,ProPublica
"Teens are spending more on video games than ever before, and it's at least partially thanks to 'Fortnite'",spending,
"Economists conclude that people are willing to put up with pay cuts, after all",willing to put up with pay,Economists
Gottheimer (D) Faces Progressive Backlash Over Border Vote,Progressive Backlash,
John Bolton Says Iran Doesn’t Own A ‘Hunting License In The Middle East’,Doesn’t Own,John Bolton
House Republicans Ask Democrats to Help Force Vote on Protecting Lives of Babies Born After Abortion,Protecting,House Republicans
Hundreds Of Students Give Final Wave Goodbye To Grandmother Who Waved To Them Every Morning,Goodbye,Hundreds Of Students
Duterte threatens 'suicide mission' if Beijing oversteps in South China Sea,suicide mission,Duterte
Ohio State officials failed to act as doctor abused 177 athletes over nearly two decades,abused,officials
White House hosts social media summit without social media companies,House,
White cop cleared in fatal shooting of black teenager,cleared,White cop
OH NOEZ! Alyssa Milano just totally doomed Amy McGrath’s entire campaign and all it took was ONE WORD,doomed,Alyssa Milano
"'For real': High school football season begins this week with expectations, excitement",excitement,High school football
Trump Attempted to Suppress State Dept. Analyst’s Testimony on Climate Crisis,Suppress,Trump
NASA says India’s anti-satellite strike endangered the International Space Station,strike,NASA
Kevin Spacey questioned by London police over UK sex assault claims,questioned,Kevin Spacey
"If Trump Had Any Sense Whatsoever, He Would Not Be Raising Tariffs After This Jobs Report",Any Sense,Trump
57 Dead In Series Of Brazil Prison Riots. More Than 40 Reportedly Showed Signs Of Asphyxiation,Dead,
"11 killed, 6 injured in Virginia Beach shooting","11 killed, 6 injured",
What it's like being a woman in media,like,
The Reporter Who Wrote About Layoffs at the Cleveland Plain Dealer After He Was Laid Off,Layoffs,The Reporter
Van with $140m of drugs crashes into police car in Sydney,crashes,
Firefighter ran 18 miles on broken foot in London Marathon,ran 18 miles,Firefighter
"Former LSU DL, Hammond native Ed Alexander gets shot at NFL with Seattle Seahawks",shot,LSU DL
"As Ilhan Omar Said, Trump Is a Fascist — and His Rallies Prove It",Fascist,Ilhan Omar
The Coming-of-Age Tale That Inspired Mayor Pete to Learn Norwegian,Inspired,Mayor Pete
Senators To Consumer Watchdog: Prove You're Protecting Student Borrowers,Protecting,Senators
"Werner Herzog's New Film Is About an Old, Dead Friend",New,Werner Herzog's
Canada Responds to Philippines' War Threat with Offer to Take Back Garbage,Threat,Canada
Bryce Harper Bats Down Frosty DC Homecoming With Home Run,Bats Down,Bryce Harper
WOW! Trump Hauls In Whopping $25 Million on Launch Day For Re-Election Campaign,Whopping,Trump
HUD’s plan to remove shelter protections for transgender people would be ‘devastating’, would be ‘devastating’,HUD
Burning Russian plane makes emergency landing,emergency,Russian plane
Bill Clinton: 'Columbine has a special place in my heart',special,Bill Clinton
US Missiles Captured at Libyan Islamic Rebel Camp – Memories of Benghazi 9-11 Attack Resurface,Captured,
"Mexico, US to launch plan against arms smuggling at border",against,"Mexico, US"
"SWAC media day: Grambling's confidence, site of conference championship game, more",confidence,SWAC
Narendra Modi’s Election Challenge: Create Jobs. Lots of Them.,Create,Narendra Modi’s
Bernie Sanders’s reparations comments cause rift over DSA endorsement,rift,Bernie Sanders’s
"“Trump Wins!”: The President, the Mueller Report, and Our New Political Normal",Wins,The President
Pete Buttigieg shows how to campaign on values in the age of Trump,values,Pete Buttigieg
Hickenlooper: Give Illegal Immigrants 10-year Visas ‘Immediately’,Illegal Immigrants,
"In Town for Tel Aviv Pride, Neil Patrick Harris Says He’s No Gay Icon",Pride,Neil Patrick Harris
‘It’s a sexist and racist attack’: Trump’s regulation to weaken home health care unions takes effect,sexist and racist,
Getting Poorer While Working Harder: The “Cliff Effect”,Poorer,
De Blasio: The NYPD will investigate the new rape claim against Trump if a complaint is filed,rape,
Buffett urges Wells to look beyond Wall St for next chief,urges,Buffett
US declining interest in history presents risk to democracy,declining,
Lucy Flores Discusses Her Allegations Against Joe Biden,Discusses,Lucy Flores
R. Kelly protegee says she's ready to testify against him again as new alleged underage sex tape surfaces,testify,Kelly
Dramatic moment lifeguards take down ‘drunk and abusive’ beachgoer,Dramatic moment,lifeguards
"Beto O’Rourke wouldn’t get rid of just the existing border wall, but maybe the citizenship test too",but maybe the citizenship test too,Beto O’Rourke
"Revulsion in Northern Ireland over riot, fatal shooting",Revulsion,
Candace Owens Gives Devastating Opening Testimony At Congressional Hearing,Devastating,Candace Owens
"In Hong Kong, common sense keeps lives safe in a typhoon",keeps,
This High School's 'Political Radicalism' Class Lets Students Hear From Far-Right and Far-Left Speakers,Lets,
Trump: ‘Something strange is going on at Fox’,Something strange,Trump
North Korean Official Reportedly Purged Seen Back In Public Alongside Kim Jong Un,Purged,
People Are Absolutely Reeling From Those Two Brutal Moments on Game of Thrones,Brutal,People
Iranian man given death penalty for 2012 murder of American woman,murder,Iranian man
Oberlin Is Forced to Check Its Woke Privilege,Forced,Oberlin
3 Reasons Not to Worry About Trump’s Fourth of July—and 1 Big Reason to Worry,Worry,Trump’s
U.N. waters down resolution on sexual violence after threat of U.S. veto,waters down,U.N.
Venezuela's top court targets opposition lawmakers,opposition,Venezuela
Beyoncé makes black feminism accessible in her Coachella film ‘Homecoming’ — building on the education she’s delivered for years,accessible,Beyoncé
Liberal Entrepreneur Gary Vee Scared of ‘Massive Entitlement’ Ideas,Scared,Liberal Entrepreneur Gary Vee
Efforts to make buildings greener are not working,not working,
Donald Trump Tells the Truth Today,Truth,Donald Trump
Trump’s ‘Madman Theory’ of Trade with China,,Trump
"US woman kidnapped on Ugandan safari: kidnappers demand $500,000",kidnapped,US woman
Government data are ever more important to economic research,research,Government
Teens Teach Boy With Autism How To Skate On His Birthday,Teach,Teens
"Russia: Militants in Syria launch attack, have toxic agents",launch attack,Russia
Colt Data Centre Services Announces Its Expansion in Frankfurt,Announces,Colt Data Centre Services
Trump and Barr Could Stretch Executive Privilege and Grand Jury Secrecy Claims,Could Stretch,Trump and Barr
Denver hospital saw three times more marijuana-related ER visits after legalization,saw,
Quinnipiac Poll: 61% Oppose Trump Impeachment,Impeachment,Trump
Lead in Topsoil Produces Kids With Cognitive Problems,Problems,
Rod Rosenstein just made a huge mistake in his resignation letter,mistake,Rod Rosenstein
6 Gun Lies (And One Truth) Obama Told In Brazil,,
"ICE Opens Transgender Housing Unit for Illegals – Teaches Self-Grooming, Provides Hormone Therapy on Taxpayer Dime",Opens,ICE
Five ways to care for your scalp,care,
Florida trooper had sex with 14-year-old girl in the back of his car: authorities,trooper had sex with 14-year-old girl,Florida
"George Kelling, Father of 'Broken Windows' Policing, Dies",Dies,George Kelling
Britain’s Tories Bravely Put Party Before Country,Party,Britain’s Tories
"Trump Slams India’s Tariffs On American Products, Says Country Has Been Having A ‘Field Day’",Slams,Trump
The Latest: Prosecutors want cruise ship captain arrested,arrested,Prosecutors
Twitter Bans ‘Dehumanizing Language’ Against Religions,Bans,Twitter
‘American Taliban’ to be released from prison Thursday,released,‘American Taliban’
TDS MELTDOWN: Mexican Trump Supporter Assaulted by Psychotic Androgynous Liberal in Post Office For Wearing MAGA Hat,Assaulted,TDS MELTDOWN
This billboard is being criticized for inciting violence against “the Squad”,criticized,
Sri Lanka attacks: CCTV shows suspected Sri Lanka church bomber,,Sri Lanka
New polling of 2020 Democrats head-to-head with Trump in a key swing state reveals his electoral weakness,electoral weakness,
"In the Future, No One Deserves an Oscar",Future,
Mad: The Hilariously Sly Magazine Hated By the Stiff Set,Hated,
Death Toll From New Zealand Mosque Shooting Rises To 51,Death,
"My dispiriting, infuriating – and illuminating – time as a political telemarketer",infuriating,
Man charged with killing 7 elderly women,killing,Man
Jeffrey Epstein in Court Today on Sex Trafficking Charges,Court,Jeffrey Epstein
Gunman Out On Parole Kills 4 In Australian City Of Darwin,Kills,Gunman
Congressman Recalls Witnessing Violent Chinese Protests At Tiananmen Square Anniversary Rally,Violent,Congressman
DGAP-Adhoc: Allgeier successfully completes capital increase,successfully,Allgeier
Jair Bolsonaro’s Brazil Is a Nightmare That Could Get Worse,Nightmare,
The 2018 Nobel peace prize is awarded to a surgeon and a former slave,awarded,
Khamenei: U.S. 'Idiots' Reached 'Rock Bottom' with IRGC Terror Label,Idiots,Khamenei
Melbourne driver who slammed into a concrete barrier breaks her silence on road rage incident,,
Sen. Tom Cotton Calls for IRS Investigation into Political Hate Group Southern Poverty Law Center,Investigation,Sen. Tom Cotton
Archbishop Says Christians Slaughtered ‘Like Chickens’ in Nigeria,Slaughtered,Archbishop
"June gold settles at $1,285.40/oz, up $11.20, or 0.9%",settles,gold
Earthquakes leaves dozens of homes unfit for living in Trona,unfit,Earthquakes
When John Paul Stevens Eviscerated Antonin Scalia,Eviscerated,John Paul Stevens
CBS: Trump’s Speeches ‘Almost Identical’ to Manifesto of Crazed Killer,Crazed Killer,
"As Saudi Arabia Builds A Nuclear Reactor, Some Worry About Its Motives",Worry,Saudi Arabia
"Journalist, 29, Shot Dead In Northern Ireland In 'Terrorist Incident’",Dead,"Journalist, 29"
Hallstatt: A town of 800 people that gets a million tourists a year,gets,
Trump signs bill ensuring 9/11 victims fund will never run out of money,signs,Trump
Today’s back pages: Stokes catch gives England a flying start in Cricket World Cup,catch,
Government Control Turns Schools into Partisan Battlegrounds,Turns,
"Man had ‘father-son’ chat with dying son before fatal stabbing, prosecutors say",‘father-son’ chat with dying son,Man
Team of American Hackers and Emirati Spies Discussed Attacking The Intercept,Attacking,American Hackers
Mohamed Morsi and the Passing of Egypt’s Democratic Moment,Passing,Mohamed Morsi
"Maximum Security owner calls Kentucky Derby disqualification 'egregious,' contemplates appeal",egregious,Maximum Security owner
Miss Alabama's first Latina contestant in 20 years sees opportunity galore,opportunity,Miss Alabama
Alex Rodriguez is accused of cheating on Jennifer Lopez AGAIN by sexting a British Playboy model,accused,Alex Rodriguez
"William Barr just threw himself to the wolves, and Donald Trump is next",threw,William Barr
"Floods, Landslides Leave Dozens Dead Across Nepal And India",Dead,Nepal And India
The New York Times Has 10 Years of Gnarly Tax Documents Showing Trump to Be a Mirage of a Man,Mirage,Trump
Moss Restaurant Iceland: at the cutting edge of New Nordic cuisine,edge,
Fortnite World Cup: 15-year-old Brit Jaden Ashman wins million dollar prize,wins,Brit Jaden Ashman
Fact checking Robert Mueller's congressional hearing,Fact,
Sen. Cornyn: Texas 'No Longer the Reliably Red State',No Longer,Sen. Cornyn
Ebola Outbreak In Congo Declared A Global Health Emergency,Ebola Outbreak,
Elizabeth Warren’s Plan To Cancel College Debt Is a Giveaway to the Well-Off and Well-Connected,Plan,
The Most Unpopular Presidential Election Winner Ever Could Win Again in 2020,Unpopular,
Parents worry more about bullying than anything else,worry,Parents
The One Lingering Flaw in Jane the Virgin’s Otherwise Perfect Ending,Flaw,Jane the Virgin’s
Progressive Jewish Group Demands End to Israel’s Brutal Occupation,Demands,Jewish Group
Trump Gives Netanyahu Part of Syria to Boost Israeli Leader’s Flagging Reelection Campaign,to Boost Israeli Leader’s Flagging Reelection Campaign,Trump
Japanese Workers Are Very Upset About Their Upcoming 10-Day Holiday,Upset,Japanese Workers
California man charged with hate crimes for sending letters threatening to kill incoming minority neighbors,charged,
Manny Pacquiao Might Be Making a Terrible Mistake,Mistake,Manny Pacquiao
Let Trump Have His Birthday Party for America,Party,Trump
Here’s why AG Barr will have the last word on the Russia investigation — even after Mueller’s testimony,last,AG Barr
Donald Trump’s orbit is spinning completely out of control today,,Donald Trump’s
Cracks open up as earthquake hits Peru,earthquake,
"Yes, My Fellow Soldiers Died in Vain",Died,
US diplomat Pompeo comes to Europe with a tough Iran message,tough,US diplomat Pompeo
"After Baby’s Death, Rhode Island 911 Operators May Receive Enhanced Training",Death,
Saudi Arabia May Execute Teenager for His Protests — Including When He Was 10,Execute,Saudi Arabia
Two Visions of the Democratic Party,Visions,
The world’s happiest people have a beautifully simple way to tackle loneliness,happiest,
India floods: Hundreds of passengers rescued from train,passengers rescued,
Britain sets record of 7 days without coal power as renewables surge,sets record,Britain
Former Peruvian president Alejandro Toledo arrested in US,arrested,Former Peruvian president Alejandro Toledo
Battle looms over full details of Mueller report,Battle,
2 IS-linked Philippine militants arrested far from south,arrested,Philippine
There's a Little Bit of Psychopath in All of Us,a Little Bit of Psychopath,
Prosecutors: Boston cabbie fatally shot after declining ride,fatally,Prosecutors
Secret Service Take Chicago Restaurant Employee into Custody After She Spits on Eric Trump,Spits,Secret Service
French tycoons show competitive streak over Notre Dame aid,competitive,French tycoons
"Kamala Harris responds to Alabama abortion ban by raising $160,000 for pro-choice groups",responds,Kamala Harris
Bolton Warns Iran: US Navy To Deploy Carrier And Bombers To Middle East,Warns,Bolton
States are finding new ways of killing enemies abroad,killing,States
"Sudanese activists, army finalize power-sharing deal",finalize power-sharing deal,Sudanese activists
Trump administration misses census printing deadline after Supreme Court citizenship question ruling,misses,Trump administration
Trump Says He'd Vouch For A$AP Rocky Amid Growing Demands For The Rapper's Release,Vouch,Trump
Bill Donohue Slams Fox News For Cutting His Segment after He Points Out Recent Attacks on French Churches,Slams,Bill Donohue
"Jason Rantz Guest Hosting: Antifa Takes over Portland, Blue Checkmarks Cheer",Takes,Jason Rantz
High-Tax Illinois Faces a Progressive Tax Push,High-Tax,Illinois
Live Updates: Firefights In Venezuelan Capital As Military Uprising Ensues,Firefights,Venezuelan Capital
"After El Paso, We Can No Longer Ignore Trump’s Role in Inspiring Mass Shootings",Shootings,Trump’s
"Overpopulation, Not Climate Change, Caused California’s Water Crisis",Crisis,
'Brexit Express' steam train runs more than 20 minutes behind,20 minutes behind,Brexit Express
Deadline passes for publication of gender pay figures,passes,
Investments Limited Bullish on South Florida Real Estate,Bullish,
‘It was not a fluke event’: Alabama Sen. Doug Jones lays out how Democrats can win in 2020,win,Alabama Sen. Doug Jones
US diplomat cites Iran threat over Saudi arms sales,threat,US diplomat
‘Heartbreaking’: Sandy Hook Father Dies in Apparent Suicide,‘Heartbreaking’,
Democrats introduce bill to reverse Trump's Muslim ban,reverse,Democrats
Teacher at top London secondary school can't read or write,can't read or write,Teacher
"Friends of Australian woman, 35, found dead in her London flat raise money to bring her body home",dead,Friends of Australian
This Refugee-Led Cooking Class Is Making Space for Cultural Exchange,Space,Refugee
Anna Sorokin: judge sentences fake German heiress to up to 12 years in prison,sentences,Anna Sorokin
Canvassing the 55 Percent of Rural Voters Wanting Medicare for All,Canvassing,
USDA Says It Will Save $20M a Year by Moving Researchers to Kansas City. Critics Say It’s All Politics.,Save,USDA
Racist texts from border agent accused of hitting migrant with truck revealed,accused,
Cops in One Village Have Been Convicted of 70 Crimes. Here’s What They Had to Say About It.,Convicted,Cops
Restaurant stocks have caught up with soaring S&P 500 gains in the last year. These 10 companies have surged and led the industry.,soaring,Restaurant
"Lakes Erie, Superior set records as water levels surge",records,Lakes Erie
Trudeau Ejects Whistle-Blowing MPs From Liberal Caucus,Ejects,Trudeau
The Dying Howls of British Politics,Dying,British Politics
"Gradually, nervously, courts are granting rights to animals",nervously,courts
Commencement Speaker Announces He Will Pay Off Class Of 2019and#039;s Student Debt,Will Pay,
New research finds the HPV vaccine is exceeding expectations and drastically cutting rates of cervical pre-cancer,drastically cutting rates,
"With Support of 8 Republicans, House Passes Equality Act",Support,
Gay Sex Is Now Punishable By Stoning To Death In Brunei,Punishable,
"San Diego synagogue shooting was almost much worse, rabbi says",shooting,San Diego
Donald Trump goes completely off the deep end about his tax returns,deep,Donald Trump
The aftermath of deadly tornadoes in Missouri,aftermath,Missouri
Ocasio-Cortez Puts the Postal Service on the Path to Ruin,Ruin,Ocasio-Cortez
Researchers Have Figured Out How To Convert All Blood Types Into The Universal Type O,Figured,
5-Year-Old Girl Forms Unbreakable Bond With A Duck,Bond,
"In a company first, Victoria's Secret hires openly transgender model",openly,Victoria's Secret
"House Dems set to subpoena Kushner, Sessions and 10 other Mueller witnesses",,House Dems
Trump Baby Blimp To Soar Again For President's UK Visit,Soar,Trump
So that was all for nothing,nothing,
Another vulnerable House Republican heads for the exit rather than run in 2020,vulnerable,
I’ve Spent Decades Talking to Parents About Vaccines. It’s Time for a Change.,Vaccines,
"It’s a Winner-Take-All World, Whether You Like It or Not",Winner,
Teacher Cuts Hair To Match Student Being Teased For Her Short Hair,Teased,Teacher
7-year-old killed after truck and horse-drawn carriage collided in Missouri,killed,
Zachary High coach hosts summer baseball camp,hosts,Zachary
Trump’s FCC votes to end local governments’ ability to regulate and charge cable broadband industry,end,Trump’s FCC
"Another hiker went missing on Maui. This time, the search ended in tragedy.",tragedy,hiker
The Voraciousness and Oddity of Dora Maar’s Pictures,Voraciousness and Oddity,
Ralph Nader's Grandniece Died in Ethiopian Plane Crash; Now He Is Urging Boycott of Boeing Jet,Died,Ralph Nader
This progressive Muslim woman could make history in Virginia’s state Senate primary race,make history,Muslim woman
"Man, 52, dies after falling down stairs following vicious attack in a pub",dies,"Man, 52"
The Alabama Abortion Law Is a Disaster for Republicans,Disaster,Republicans
The Tenants’ Rights Movement Is Expanding Beyond Big Cities,Rights Movement,
Conversations with Ma: Making Wreaths and Having Kids,Wreaths,
Michelle Obama's Ex-Chief Of Staff Admits She Did Try To Intervene In Smollett Investigation,Intervene,Michelle Obama's
What men need to give to make gender equality a reality: 50 minutes a day,need to give,
14 sailors killed in submarine fire laid to rest in Russia,killed,
Injured turtle saved by a bra,saved,
"Massive Hong Kong Protests Demand Withdrawal of Extradition Bill, Leader's Resignation",Massive Hong Kong Protests,
Asylum-seeker falsely accused of gang ties by border officials is reunited with kids after 184 days,accused,Asylum-seeker
Natural History Museum Won't Host Event Honoring Brazil President Jair Bolsonaro,Won't Host,
"Ocasio-Cortez calls out Steve King, Liz Cheney amid controversy over concentration camp remarks",controversy,Ocasio-Cortez
Trump official blames migrant father for drowning with daughter,blames,
"Growing number of Latinos broaden labor's mission, political power",Growing,Latinos
California man who kept runaway teen in metal box at pot farm sentenced to 31 years in prison,sentenced,California man
Study: Children Near Lead Smelters Are Exposed to Lead in the Womb,Exposed,Children
Nothing More Powerful Than Liberal Privilege,Privilege,
TAC Bookshelf for the Week of March 18,Bookshelf,
The Psychological Effects of Grieving on Social Media,Effects,
"Fed ready to act if economy worsens, Powell says",worsens,Powell
"Julian Castro says Kellyanne should go, defends own Hatch Act violation",defends,Julian Castro
Eli Lilly stock price target cut to $118 from $120 at CFRA,cut,Eli Lilly
Democrats Hit Trump’s Trans-Troop Ban as It Takes Effect,Hit Trump’s Trans-Troop Ban,Democrats
Alabama Senate Votes to Virtually Eliminate Tourism to Alabama,Eliminate,Alabama Senate
Koepka to stick with same British Open preparation plan,stick,Koepka
Gold-plated golf clubs and birthday bashes: How Abe courts Trump,birthday,
The Revolution Comes For Creepy Uncle Joe,Creepy,Joe
The Troubling Legacy of Martin Luther King,Legacy,Martin Luther King
US Border Patrol Is the Most Brutal Militia of All,Brutal,
Climate Change Is This Generation’s Vietnam War,Climate Change,Climate Change
French Billionaires Pledge $450 Million To Help Rebuild The Notre Dame Cathedral,Pledge,French Billionaires
